{
  "address": "0x73860035637c36b80D537238eb9B8887A2009EaE",
  "abi": [
    {
      "anonymous": false,
      "inputs": [
        {
          "indexed": false,
          "internalType": "contract GnosisSafeProxy",
          "name": "proxy",
          "type": "address"
        },
        {
          "indexed": false,
          "internalType": "address",
          "name": "singleton",
          "type": "address"
        }
      ],
      "name": "ProxyCreation",
      "type": "event"
    },
    {
      "inputs": [
        {
          "internalType": "address",
          "name": "_singleton",
          "type": "address"
        },
        {
          "internalType": "bytes",
          "name": "initializer",
          "type": "bytes"
        },
        {
          "internalType": "uint256",
          "name": "saltNonce",
          "type": "uint256"
        }
      ],
      "name": "calculateCreateProxyWithNonceAddress",
      "outputs": [
        {
          "internalType": "contract GnosisSafeProxy",
          "name": "proxy",
          "type": "address"
        }
      ],
      "stateMutability": "nonpayable",
      "type": "function"
    },
    {
      "inputs": [
        {
          "internalType": "address",
          "name": "singleton",
          "type": "address"
        },
        {
          "internalType": "bytes",
          "name": "data",
          "type": "bytes"
        }
      ],
      "name": "createProxy",
      "outputs": [
        {
          "internalType": "contract GnosisSafeProxy",
          "name": "proxy",
          "type": "address"
        }
      ],
      "stateMutability": "nonpayable",
      "type": "function"
    },
    {
      "inputs": [
        {
          "internalType": "address",
          "name": "_singleton",
          "type": "address"
        },
        {
          "internalType": "bytes",
          "name": "initializer",
          "type": "bytes"
        },
        {
          "internalType": "uint256",
          "name": "saltNonce",
          "type": "uint256"
        },
        {
          "internalType": "contract IProxyCreationCallback",
          "name": "callback",
          "type": "address"
        }
      ],
      "name": "createProxyWithCallback",
      "outputs": [
        {
          "internalType": "contract GnosisSafeProxy",
          "name": "proxy",
          "type": "address"
        }
      ],
      "stateMutability": "nonpayable",
      "type": "function"
    },
    {
      "inputs": [
        {
          "internalType": "address",
          "name": "_singleton",
          "type": "address"
        },
        {
          "internalType": "bytes",
          "name": "initializer",
          "type": "bytes"
        },
        {
          "internalType": "uint256",
          "name": "saltNonce",
          "type": "uint256"
        }
      ],
      "name": "createProxyWithNonce",
      "outputs": [
        {
          "internalType": "contract GnosisSafeProxy",
          "name": "proxy",
          "type": "address"
        }
      ],
      "stateMutability": "nonpayable",
      "type": "function"
    },
    {
      "inputs": [],
      "name": "proxyCreationCode",
      "outputs": [
        {
          "internalType": "bytes",
          "name": "",
          "type": "bytes"
        }
      ],
      "stateMutability": "pure",
      "type": "function"
    },
    {
      "inputs": [],
      "name": "proxyRuntimeCode",
      "outputs": [
        {
          "internalType": "bytes",
          "name": "",
          "type": "bytes"
        }
      ],
      "stateMutability": "pure",
      "type": "function"
    }
  ],
  "transactionHash": "0x32fd4f78c9b6ad0418933831d71fd67f76a8a9fd7dbb09d4645ccda7ffbf685b",
  "receipt": {
    "to": null,
    "from": "0xF0011928B8059a33b05b6aF591dFB0870E6f4aD7",
    "contractAddress": "0x73860035637c36b80D537238eb9B8887A2009EaE",
    "transactionIndex": 1,
    "gasUsed": "595153",
    "logsBloom": "0x00000000000000000000000000000000000000000000000000000000000000000000000000000000000000000000000000000000000000000000000000000000000000000000000000000000000000000000000000000000000000000000000000000000000000000000000000000000000000000000000000000000000000000000000000000000000000000000000000000000000000000000000000000000000000000000000000000000000000000000000000000000000000000000000000000000000000000000000000000000000000000000000000000000000000000000000000000000000000000000000000000000000000000000000000000000",
    "blockHash": "0xfff939b189e75e8d3dc69cd9c3b6114cd0abf24d6c9441af50daf0d441c295fd",
    "transactionHash": "0x32fd4f78c9b6ad0418933831d71fd67f76a8a9fd7dbb09d4645ccda7ffbf685b",
    "logs": [],
    "blockNumber": 7106382,
    "cumulativeGasUsed": "679385",
    "status": 1,
    "byzantium": true
  },
  "args": [],
  "solcInputHash": "45b4746d93df52f2fa3fac570dd755d8",
  "metadata": "{\"compiler\":{\"version\":\"0.8.10+commit.fc410830\"},\"language\":\"Solidity\",\"output\":{\"abi\":[{\"anonymous\":false,\"inputs\":[{\"indexed\":false,\"internalType\":\"contract GnosisSafeProxy\",\"name\":\"proxy\",\"type\":\"address\"},{\"indexed\":false,\"internalType\":\"address\",\"name\":\"singleton\",\"type\":\"address\"}],\"name\":\"ProxyCreation\",\"type\":\"event\"},{\"inputs\":[{\"internalType\":\"address\",\"name\":\"_singleton\",\"type\":\"address\"},{\"internalType\":\"bytes\",\"name\":\"initializer\",\"type\":\"bytes\"},{\"internalType\":\"uint256\",\"name\":\"saltNonce\",\"type\":\"uint256\"}],\"name\":\"calculateCreateProxyWithNonceAddress\",\"outputs\":[{\"internalType\":\"contract GnosisSafeProxy\",\"name\":\"proxy\",\"type\":\"address\"}],\"stateMutability\":\"nonpayable\",\"type\":\"function\"},{\"inputs\":[{\"internalType\":\"address\",\"name\":\"singleton\",\"type\":\"address\"},{\"internalType\":\"bytes\",\"name\":\"data\",\"type\":\"bytes\"}],\"name\":\"createProxy\",\"outputs\":[{\"internalType\":\"contract GnosisSafeProxy\",\"name\":\"proxy\",\"type\":\"address\"}],\"stateMutability\":\"nonpayable\",\"type\":\"function\"},{\"inputs\":[{\"internalType\":\"address\",\"name\":\"_singleton\",\"type\":\"address\"},{\"internalType\":\"bytes\",\"name\":\"initializer\",\"type\":\"bytes\"},{\"internalType\":\"uint256\",\"name\":\"saltNonce\",\"type\":\"uint256\"},{\"internalType\":\"contract IProxyCreationCallback\",\"name\":\"callback\",\"type\":\"address\"}],\"name\":\"createProxyWithCallback\",\"outputs\":[{\"internalType\":\"contract GnosisSafeProxy\",\"name\":\"proxy\",\"type\":\"address\"}],\"stateMutability\":\"nonpayable\",\"type\":\"function\"},{\"inputs\":[{\"internalType\":\"address\",\"name\":\"_singleton\",\"type\":\"address\"},{\"internalType\":\"bytes\",\"name\":\"initializer\",\"type\":\"bytes\"},{\"internalType\":\"uint256\",\"name\":\"saltNonce\",\"type\":\"uint256\"}],\"name\":\"createProxyWithNonce\",\"outputs\":[{\"internalType\":\"contract GnosisSafeProxy\",\"name\":\"proxy\",\"type\":\"address\"}],\"stateMutability\":\"nonpayable\",\"type\":\"function\"},{\"inputs\":[],\"name\":\"proxyCreationCode\",\"outputs\":[{\"internalType\":\"bytes\",\"name\":\"\",\"type\":\"bytes\"}],\"stateMutability\":\"pure\",\"type\":\"function\"},{\"inputs\":[],\"name\":\"proxyRuntimeCode\",\"outputs\":[{\"internalType\":\"bytes\",\"name\":\"\",\"type\":\"bytes\"}],\"stateMutability\":\"pure\",\"type\":\"function\"}],\"devdoc\":{\"author\":\"Stefan George - <stefan@gnosis.pm>\",\"kind\":\"dev\",\"methods\":{\"calculateCreateProxyWithNonceAddress(address,bytes,uint256)\":{\"details\":\"Allows to get the address for a new proxy contact created via `createProxyWithNonce`      This method is only meant for address calculation purpose when you use an initializer that would revert,      therefore the response is returned with a revert. When calling this method set `from` to the address of the proxy factory.\",\"params\":{\"_singleton\":\"Address of singleton contract.\",\"initializer\":\"Payload for message call sent to new proxy contract.\",\"saltNonce\":\"Nonce that will be used to generate the salt to calculate the address of the new proxy contract.\"}},\"createProxy(address,bytes)\":{\"details\":\"Allows to create new proxy contact and execute a message call to the new proxy within one transaction.\",\"params\":{\"data\":\"Payload for message call sent to new proxy contract.\",\"singleton\":\"Address of singleton contract.\"}},\"createProxyWithCallback(address,bytes,uint256,address)\":{\"details\":\"Allows to create new proxy contact, execute a message call to the new proxy and call a specified callback within one transaction\",\"params\":{\"_singleton\":\"Address of singleton contract.\",\"callback\":\"Callback that will be invoced after the new proxy contract has been successfully deployed and initialized.\",\"initializer\":\"Payload for message call sent to new proxy contract.\",\"saltNonce\":\"Nonce that will be used to generate the salt to calculate the address of the new proxy contract.\"}},\"createProxyWithNonce(address,bytes,uint256)\":{\"details\":\"Allows to create new proxy contact and execute a message call to the new proxy within one transaction.\",\"params\":{\"_singleton\":\"Address of singleton contract.\",\"initializer\":\"Payload for message call sent to new proxy contract.\",\"saltNonce\":\"Nonce that will be used to generate the salt to calculate the address of the new proxy contract.\"}},\"proxyCreationCode()\":{\"details\":\"Allows to retrieve the creation code used for the Proxy deployment. With this it is easily possible to calculate predicted address.\"},\"proxyRuntimeCode()\":{\"details\":\"Allows to retrieve the runtime code of a deployed Proxy. This can be used to check that the expected Proxy was deployed.\"}},\"title\":\"Proxy Factory - Allows to create new proxy contact and execute a message call to the new proxy within one transaction.\",\"version\":1},\"userdoc\":{\"kind\":\"user\",\"methods\":{},\"version\":1}},\"settings\":{\"compilationTarget\":{\"@gnosis.pm/safe-contracts/contracts/proxies/GnosisSafeProxyFactory.sol\":\"GnosisSafeProxyFactory\"},\"evmVersion\":\"london\",\"libraries\":{},\"metadata\":{\"bytecodeHash\":\"none\",\"useLiteralContent\":true},\"optimizer\":{\"enabled\":true,\"runs\":800},\"remappings\":[]},\"sources\":{\"@gnosis.pm/safe-contracts/contracts/proxies/GnosisSafeProxy.sol\":{\"content\":\"// SPDX-License-Identifier: LGPL-3.0-only\\npragma solidity >=0.7.0 <0.9.0;\\n\\n/// @title IProxy - Helper interface to access masterCopy of the Proxy on-chain\\n/// @author Richard Meissner - <richard@gnosis.io>\\ninterface IProxy {\\n    function masterCopy() external view returns (address);\\n}\\n\\n/// @title GnosisSafeProxy - Generic proxy contract allows to execute all transactions applying the code of a master contract.\\n/// @author Stefan George - <stefan@gnosis.io>\\n/// @author Richard Meissner - <richard@gnosis.io>\\ncontract GnosisSafeProxy {\\n    // singleton always needs to be first declared variable, to ensure that it is at the same location in the contracts to which calls are delegated.\\n    // To reduce deployment costs this variable is internal and needs to be retrieved via `getStorageAt`\\n    address internal singleton;\\n\\n    /// @dev Constructor function sets address of singleton contract.\\n    /// @param _singleton Singleton address.\\n    constructor(address _singleton) {\\n        require(_singleton != address(0), \\\"Invalid singleton address provided\\\");\\n        singleton = _singleton;\\n    }\\n\\n    /// @dev Fallback function forwards all transactions and returns all received return data.\\n    fallback() external payable {\\n        // solhint-disable-next-line no-inline-assembly\\n        assembly {\\n            let _singleton := and(sload(0), 0xffffffffffffffffffffffffffffffffffffffff)\\n            // 0xa619486e == keccak(\\\"masterCopy()\\\"). The value is right padded to 32-bytes with 0s\\n            if eq(calldataload(0), 0xa619486e00000000000000000000000000000000000000000000000000000000) {\\n                mstore(0, _singleton)\\n                return(0, 0x20)\\n            }\\n            calldatacopy(0, 0, calldatasize())\\n            let success := delegatecall(gas(), _singleton, 0, calldatasize(), 0, 0)\\n            returndatacopy(0, 0, returndatasize())\\n            if eq(success, 0) {\\n                revert(0, returndatasize())\\n            }\\n            return(0, returndatasize())\\n        }\\n    }\\n}\\n\",\"keccak256\":\"0x3bfdd453d9f896f7029d15bcafd11886957b320ad1764309d9f74fa059715249\",\"license\":\"LGPL-3.0-only\"},\"@gnosis.pm/safe-contracts/contracts/proxies/GnosisSafeProxyFactory.sol\":{\"content\":\"// SPDX-License-Identifier: LGPL-3.0-only\\npragma solidity >=0.7.0 <0.9.0;\\n\\nimport \\\"./GnosisSafeProxy.sol\\\";\\nimport \\\"./IProxyCreationCallback.sol\\\";\\n\\n/// @title Proxy Factory - Allows to create new proxy contact and execute a message call to the new proxy within one transaction.\\n/// @author Stefan George - <stefan@gnosis.pm>\\ncontract GnosisSafeProxyFactory {\\n    event ProxyCreation(GnosisSafeProxy proxy, address singleton);\\n\\n    /// @dev Allows to create new proxy contact and execute a message call to the new proxy within one transaction.\\n    /// @param singleton Address of singleton contract.\\n    /// @param data Payload for message call sent to new proxy contract.\\n    function createProxy(address singleton, bytes memory data) public returns (GnosisSafeProxy proxy) {\\n        proxy = new GnosisSafeProxy(singleton);\\n        if (data.length > 0)\\n            // solhint-disable-next-line no-inline-assembly\\n            assembly {\\n                if eq(call(gas(), proxy, 0, add(data, 0x20), mload(data), 0, 0), 0) {\\n                    revert(0, 0)\\n                }\\n            }\\n        emit ProxyCreation(proxy, singleton);\\n    }\\n\\n    /// @dev Allows to retrieve the runtime code of a deployed Proxy. This can be used to check that the expected Proxy was deployed.\\n    function proxyRuntimeCode() public pure returns (bytes memory) {\\n        return type(GnosisSafeProxy).runtimeCode;\\n    }\\n\\n    /// @dev Allows to retrieve the creation code used for the Proxy deployment. With this it is easily possible to calculate predicted address.\\n    function proxyCreationCode() public pure returns (bytes memory) {\\n        return type(GnosisSafeProxy).creationCode;\\n    }\\n\\n    /// @dev Allows to create new proxy contact using CREATE2 but it doesn't run the initializer.\\n    ///      This method is only meant as an utility to be called from other methods\\n    /// @param _singleton Address of singleton contract.\\n    /// @param initializer Payload for message call sent to new proxy contract.\\n    /// @param saltNonce Nonce that will be used to generate the salt to calculate the address of the new proxy contract.\\n    function deployProxyWithNonce(\\n        address _singleton,\\n        bytes memory initializer,\\n        uint256 saltNonce\\n    ) internal returns (GnosisSafeProxy proxy) {\\n        // If the initializer changes the proxy address should change too. Hashing the initializer data is cheaper than just concatinating it\\n        bytes32 salt = keccak256(abi.encodePacked(keccak256(initializer), saltNonce));\\n        bytes memory deploymentData = abi.encodePacked(type(GnosisSafeProxy).creationCode, uint256(uint160(_singleton)));\\n        // solhint-disable-next-line no-inline-assembly\\n        assembly {\\n            proxy := create2(0x0, add(0x20, deploymentData), mload(deploymentData), salt)\\n        }\\n        require(address(proxy) != address(0), \\\"Create2 call failed\\\");\\n    }\\n\\n    /// @dev Allows to create new proxy contact and execute a message call to the new proxy within one transaction.\\n    /// @param _singleton Address of singleton contract.\\n    /// @param initializer Payload for message call sent to new proxy contract.\\n    /// @param saltNonce Nonce that will be used to generate the salt to calculate the address of the new proxy contract.\\n    function createProxyWithNonce(\\n        address _singleton,\\n        bytes memory initializer,\\n        uint256 saltNonce\\n    ) public returns (GnosisSafeProxy proxy) {\\n        proxy = deployProxyWithNonce(_singleton, initializer, saltNonce);\\n        if (initializer.length > 0)\\n            // solhint-disable-next-line no-inline-assembly\\n            assembly {\\n                if eq(call(gas(), proxy, 0, add(initializer, 0x20), mload(initializer), 0, 0), 0) {\\n                    revert(0, 0)\\n                }\\n            }\\n        emit ProxyCreation(proxy, _singleton);\\n    }\\n\\n    /// @dev Allows to create new proxy contact, execute a message call to the new proxy and call a specified callback within one transaction\\n    /// @param _singleton Address of singleton contract.\\n    /// @param initializer Payload for message call sent to new proxy contract.\\n    /// @param saltNonce Nonce that will be used to generate the salt to calculate the address of the new proxy contract.\\n    /// @param callback Callback that will be invoced after the new proxy contract has been successfully deployed and initialized.\\n    function createProxyWithCallback(\\n        address _singleton,\\n        bytes memory initializer,\\n        uint256 saltNonce,\\n        IProxyCreationCallback callback\\n    ) public returns (GnosisSafeProxy proxy) {\\n        uint256 saltNonceWithCallback = uint256(keccak256(abi.encodePacked(saltNonce, callback)));\\n        proxy = createProxyWithNonce(_singleton, initializer, saltNonceWithCallback);\\n        if (address(callback) != address(0)) callback.proxyCreated(proxy, _singleton, initializer, saltNonce);\\n    }\\n\\n    /// @dev Allows to get the address for a new proxy contact created via `createProxyWithNonce`\\n    ///      This method is only meant for address calculation purpose when you use an initializer that would revert,\\n    ///      therefore the response is returned with a revert. When calling this method set `from` to the address of the proxy factory.\\n    /// @param _singleton Address of singleton contract.\\n    /// @param initializer Payload for message call sent to new proxy contract.\\n    /// @param saltNonce Nonce that will be used to generate the salt to calculate the address of the new proxy contract.\\n    function calculateCreateProxyWithNonceAddress(\\n        address _singleton,\\n        bytes calldata initializer,\\n        uint256 saltNonce\\n    ) external returns (GnosisSafeProxy proxy) {\\n        proxy = deployProxyWithNonce(_singleton, initializer, saltNonce);\\n        revert(string(abi.encodePacked(proxy)));\\n    }\\n}\\n\",\"keccak256\":\"0x187c6f84c71b432da6721c1b81cebfbb9c37c0cc15ebd8de5a14ff7ec6db2d9e\",\"license\":\"LGPL-3.0-only\"},\"@gnosis.pm/safe-contracts/contracts/proxies/IProxyCreationCallback.sol\":{\"content\":\"// SPDX-License-Identifier: LGPL-3.0-only\\npragma solidity >=0.7.0 <0.9.0;\\nimport \\\"./GnosisSafeProxy.sol\\\";\\n\\ninterface IProxyCreationCallback {\\n    function proxyCreated(\\n        GnosisSafeProxy proxy,\\n        address _singleton,\\n        bytes calldata initializer,\\n        uint256 saltNonce\\n    ) external;\\n}\\n\",\"keccak256\":\"0x51a9ce914a6a943651c803541e44218a7ed0a2f98a94d55df66b173b5a11e365\",\"license\":\"LGPL-3.0-only\"}},\"version\":1}",
  "bytecode": "0x608060405234801561001057600080fd5b506109d0806100206000396000f3fe608060405234801561001057600080fd5b50600436106100725760003560e01c806361b69abd1161005057806361b69abd146100cf578063addacc0f146100e2578063d18af54d146100ea57600080fd5b80631688f0b9146100775780632500510e146100a757806353e5d935146100ba575b600080fd5b61008a610085366004610597565b6100fd565b6040516001600160a01b0390911681526020015b60405180910390f35b61008a6100b53660046105f0565b610179565b6100c261020e565b60405161009e91906106d7565b61008a6100dd3660046106f1565b610238565b6100c26102e2565b61008a6100f8366004610741565b6102f4565b600061010a8484846103ca565b83519091501561012f5760008060008551602087016000865af1141561012f57600080fd5b604080516001600160a01b038084168252861660208201527f4f51faf6c4561ff95f067657e43439f0f856d97c04d9ec9070a6199ad418e235910160405180910390a19392505050565b60006101bd8585858080601f0160208091040260200160405190810160405280939291908181526020018383808284376000920191909152508792506103ca915050565b6040516bffffffffffffffffffffffff19606083901b16602082015290915060340160408051601f198184030181529082905262461bcd60e51b8252610205916004016106d7565b60405180910390fd5b606060405180602001610220906104c3565b601f1982820381018352601f90910116604052919050565b600082604051610247906104c3565b6001600160a01b039091168152602001604051809103906000f080158015610273573d6000803e3d6000fd5b508251909150156102995760008060008451602086016000865af1141561029957600080fd5b604080516001600160a01b038084168252851660208201527f4f51faf6c4561ff95f067657e43439f0f856d97c04d9ec9070a6199ad418e235910160405180910390a192915050565b606060405180602001610220906104d0565b600080838360405160200161032592919091825260601b6bffffffffffffffffffffffff1916602082015260340190565b6040516020818303038152906040528051906020012060001c905061034b8686836100fd565b91506001600160a01b038316156103c1576040516303ca56a360e31b81526001600160a01b03841690631e52b5189061038e9085908a908a908a906004016107ad565b600060405180830381600087803b1580156103a857600080fd5b505af11580156103bc573d6000803e3d6000fd5b505050505b50949350505050565b6000808380519060200120836040516020016103f0929190918252602082015260400190565b60405160208183030381529060405280519060200120905060006040518060200161041a906104c3565b601f1982820381018352601f90910116604081905261044791906001600160a01b038916906020016107ea565b6040516020818303038152906040529050818151826020016000f592506001600160a01b0383166104ba5760405162461bcd60e51b815260206004820152601360248201527f437265617465322063616c6c206661696c6564000000000000000000000000006044820152606401610205565b50509392505050565b6101578061080d83390190565b60608061096483390190565b6001600160a01b03811681146104f157600080fd5b50565b634e487b7160e01b600052604160045260246000fd5b600082601f83011261051b57600080fd5b813567ffffffffffffffff80821115610536576105366104f4565b604051601f8301601f19908116603f0116810190828211818310171561055e5761055e6104f4565b8160405283815286602085880101111561057757600080fd5b836020870160208301376000602085830101528094505050505092915050565b6000806000606084860312156105ac57600080fd5b83356105b7816104dc565b9250602084013567ffffffffffffffff8111156105d357600080fd5b6105df8682870161050a565b925050604084013590509250925092565b6000806000806060858703121561060657600080fd5b8435610611816104dc565b9350602085013567ffffffffffffffff8082111561062e57600080fd5b818701915087601f83011261064257600080fd5b81358181111561065157600080fd5b88602082850101111561066357600080fd5b95986020929092019750949560400135945092505050565b60005b8381101561069657818101518382015260200161067e565b838111156106a5576000848401525b50505050565b600081518084526106c381602086016020860161067b565b601f01601f19169290920160200192915050565b6020815260006106ea60208301846106ab565b9392505050565b6000806040838503121561070457600080fd5b823561070f816104dc565b9150602083013567ffffffffffffffff81111561072b57600080fd5b6107378582860161050a565b9150509250929050565b6000806000806080858703121561075757600080fd5b8435610762816104dc565b9350602085013567ffffffffffffffff81111561077e57600080fd5b61078a8782880161050a565b9350506040850135915060608501356107a2816104dc565b939692955090935050565b60006001600160a01b038087168352808616602084015250608060408301526107d960808301856106ab565b905082606083015295945050505050565b600083516107fc81846020880161067b565b919091019182525060200191905056fe608060405234801561001057600080fd5b5060405161015738038061015783398101604081905261002f916100b9565b6001600160a01b0381166100945760405162461bcd60e51b815260206004820152602260248201527f496e76616c69642073696e676c65746f6e20616464726573732070726f766964604482015261195960f21b606482015260840160405180910390fd5b600080546001600160a01b0319166001600160a01b03929092169190911790556100e9565b6000602082840312156100cb57600080fd5b81516001600160a01b03811681146100e257600080fd5b9392505050565b6060806100f76000396000f3fe60806040526000805473ffffffffffffffffffffffffffffffffffffffff16813563530ca43760e11b1415603557808252602082f35b3682833781823684845af490503d82833e80604e573d82fd5b503d81f3fea164736f6c634300080a000a60806040526000805473ffffffffffffffffffffffffffffffffffffffff16813563530ca43760e11b1415603557808252602082f35b3682833781823684845af490503d82833e80604e573d82fd5b503d81f3fea164736f6c634300080a000aa164736f6c634300080a000a",
  "deployedBytecode": "0x608060405234801561001057600080fd5b50600436106100725760003560e01c806361b69abd1161005057806361b69abd146100cf578063addacc0f146100e2578063d18af54d146100ea57600080fd5b80631688f0b9146100775780632500510e146100a757806353e5d935146100ba575b600080fd5b61008a610085366004610597565b6100fd565b6040516001600160a01b0390911681526020015b60405180910390f35b61008a6100b53660046105f0565b610179565b6100c261020e565b60405161009e91906106d7565b61008a6100dd3660046106f1565b610238565b6100c26102e2565b61008a6100f8366004610741565b6102f4565b600061010a8484846103ca565b83519091501561012f5760008060008551602087016000865af1141561012f57600080fd5b604080516001600160a01b038084168252861660208201527f4f51faf6c4561ff95f067657e43439f0f856d97c04d9ec9070a6199ad418e235910160405180910390a19392505050565b60006101bd8585858080601f0160208091040260200160405190810160405280939291908181526020018383808284376000920191909152508792506103ca915050565b6040516bffffffffffffffffffffffff19606083901b16602082015290915060340160408051601f198184030181529082905262461bcd60e51b8252610205916004016106d7565b60405180910390fd5b606060405180602001610220906104c3565b601f1982820381018352601f90910116604052919050565b600082604051610247906104c3565b6001600160a01b039091168152602001604051809103906000f080158015610273573d6000803e3d6000fd5b508251909150156102995760008060008451602086016000865af1141561029957600080fd5b604080516001600160a01b038084168252851660208201527f4f51faf6c4561ff95f067657e43439f0f856d97c04d9ec9070a6199ad418e235910160405180910390a192915050565b606060405180602001610220906104d0565b600080838360405160200161032592919091825260601b6bffffffffffffffffffffffff1916602082015260340190565b6040516020818303038152906040528051906020012060001c905061034b8686836100fd565b91506001600160a01b038316156103c1576040516303ca56a360e31b81526001600160a01b03841690631e52b5189061038e9085908a908a908a906004016107ad565b600060405180830381600087803b1580156103a857600080fd5b505af11580156103bc573d6000803e3d6000fd5b505050505b50949350505050565b6000808380519060200120836040516020016103f0929190918252602082015260400190565b60405160208183030381529060405280519060200120905060006040518060200161041a906104c3565b601f1982820381018352601f90910116604081905261044791906001600160a01b038916906020016107ea565b6040516020818303038152906040529050818151826020016000f592506001600160a01b0383166104ba5760405162461bcd60e51b815260206004820152601360248201527f437265617465322063616c6c206661696c6564000000000000000000000000006044820152606401610205565b50509392505050565b6101578061080d83390190565b60608061096483390190565b6001600160a01b03811681146104f157600080fd5b50565b634e487b7160e01b600052604160045260246000fd5b600082601f83011261051b57600080fd5b813567ffffffffffffffff80821115610536576105366104f4565b604051601f8301601f19908116603f0116810190828211818310171561055e5761055e6104f4565b8160405283815286602085880101111561057757600080fd5b836020870160208301376000602085830101528094505050505092915050565b6000806000606084860312156105ac57600080fd5b83356105b7816104dc565b9250602084013567ffffffffffffffff8111156105d357600080fd5b6105df8682870161050a565b925050604084013590509250925092565b6000806000806060858703121561060657600080fd5b8435610611816104dc565b9350602085013567ffffffffffffffff8082111561062e57600080fd5b818701915087601f83011261064257600080fd5b81358181111561065157600080fd5b88602082850101111561066357600080fd5b95986020929092019750949560400135945092505050565b60005b8381101561069657818101518382015260200161067e565b838111156106a5576000848401525b50505050565b600081518084526106c381602086016020860161067b565b601f01601f19169290920160200192915050565b6020815260006106ea60208301846106ab565b9392505050565b6000806040838503121561070457600080fd5b823561070f816104dc565b9150602083013567ffffffffffffffff81111561072b57600080fd5b6107378582860161050a565b9150509250929050565b6000806000806080858703121561075757600080fd5b8435610762816104dc565b9350602085013567ffffffffffffffff81111561077e57600080fd5b61078a8782880161050a565b9350506040850135915060608501356107a2816104dc565b939692955090935050565b60006001600160a01b038087168352808616602084015250608060408301526107d960808301856106ab565b905082606083015295945050505050565b600083516107fc81846020880161067b565b919091019182525060200191905056fe608060405234801561001057600080fd5b5060405161015738038061015783398101604081905261002f916100b9565b6001600160a01b0381166100945760405162461bcd60e51b815260206004820152602260248201527f496e76616c69642073696e676c65746f6e20616464726573732070726f766964604482015261195960f21b606482015260840160405180910390fd5b600080546001600160a01b0319166001600160a01b03929092169190911790556100e9565b6000602082840312156100cb57600080fd5b81516001600160a01b03811681146100e257600080fd5b9392505050565b6060806100f76000396000f3fe60806040526000805473ffffffffffffffffffffffffffffffffffffffff16813563530ca43760e11b1415603557808252602082f35b3682833781823684845af490503d82833e80604e573d82fd5b503d81f3fea164736f6c634300080a000a60806040526000805473ffffffffffffffffffffffffffffffffffffffff16813563530ca43760e11b1415603557808252602082f35b3682833781823684845af490503d82833e80604e573d82fd5b503d81f3fea164736f6c634300080a000aa164736f6c634300080a000a",
  "devdoc": {
    "author": "Stefan George - <stefan@gnosis.pm>",
    "kind": "dev",
    "methods": {
      "calculateCreateProxyWithNonceAddress(address,bytes,uint256)": {
        "details": "Allows to get the address for a new proxy contact created via `createProxyWithNonce`      This method is only meant for address calculation purpose when you use an initializer that would revert,      therefore the response is returned with a revert. When calling this method set `from` to the address of the proxy factory.",
        "params": {
          "_singleton": "Address of singleton contract.",
          "initializer": "Payload for message call sent to new proxy contract.",
          "saltNonce": "Nonce that will be used to generate the salt to calculate the address of the new proxy contract."
        }
      },
      "createProxy(address,bytes)": {
        "details": "Allows to create new proxy contact and execute a message call to the new proxy within one transaction.",
        "params": {
          "data": "Payload for message call sent to new proxy contract.",
          "singleton": "Address of singleton contract."
        }
      },
      "createProxyWithCallback(address,bytes,uint256,address)": {
        "details": "Allows to create new proxy contact, execute a message call to the new proxy and call a specified callback within one transaction",
        "params": {
          "_singleton": "Address of singleton contract.",
          "callback": "Callback that will be invoced after the new proxy contract has been successfully deployed and initialized.",
          "initializer": "Payload for message call sent to new proxy contract.",
          "saltNonce": "Nonce that will be used to generate the salt to calculate the address of the new proxy contract."
        }
      },
      "createProxyWithNonce(address,bytes,uint256)": {
        "details": "Allows to create new proxy contact and execute a message call to the new proxy within one transaction.",
        "params": {
          "_singleton": "Address of singleton contract.",
          "initializer": "Payload for message call sent to new proxy contract.",
          "saltNonce": "Nonce that will be used to generate the salt to calculate the address of the new proxy contract."
        }
      },
      "proxyCreationCode()": {
        "details": "Allows to retrieve the creation code used for the Proxy deployment. With this it is easily possible to calculate predicted address."
      },
      "proxyRuntimeCode()": {
        "details": "Allows to retrieve the runtime code of a deployed Proxy. This can be used to check that the expected Proxy was deployed."
      }
    },
    "title": "Proxy Factory - Allows to create new proxy contact and execute a message call to the new proxy within one transaction.",
    "version": 1
  },
  "userdoc": {
    "kind": "user",
    "methods": {},
    "version": 1
  },
  "storageLayout": {
    "storage": [],
    "types": null
  }
}